{
  "$schema": "https://json-schema.org/draft/2020-12/schema",
  "title": "Node Codecurency Record",
  "type": "object",
  "properties": {
    "nodeId": { "type": "string", "description": "Unique identifier for the node" },
    "nodeType": { "type": "string", "description": "Type of node (e.g., AI Server, Ethernet Switch, Management Tray)" },
    "hostname": { "type": "string", "description": "Node hostname" },
    "networkConfiguration": {
      "type": "object",
      "description": "Network configuration details for the node",
      "properties": {
        "ipAddresses": { "type": "array", "items": { "type": "string", "format": "ipv4" } },
        "ports": { "type": "array", "items": { "type": "integer", "minimum": 1, "maximum": 65535 } },
        "macAddresses": { "type": "array", "items": { "type": "string", "pattern": "^([0-9A-Fa-f]{2}:){5}[0-9A-Fa-f]{2}$" } }
      },
      "required": ["ipAddresses"]
    },
    "physicalLocation": {
      "type": "object",
      "description": "Physical location of the node in the datacenter",
      "properties": {
        "rack": { "type": "string" },
        "row": { "type": "string" },
        "datacenter": { "type": "string" },
        "placement": {
          "type": "object",
          "properties": {
            "type": { "type": "string", "enum": ["RackSlot", "Bay"] },
            "slot": { "type": "integer", "description": "Rack unit position if RackSlot" },
            "heightInU": { "type": "integer", "description": "Height in U if RackSlot" },
            "bayId": { "type": "string", "description": "Bay identifier if Bay" },
            "bayPosition": { "type": "string", "description": "Position within the bay" }
          },
          "required": ["type"]
        }
      },
      "required": ["rack", "row", "datacenter", "placement"]
    },
    "assemblies": {
      "type": "array",
      "description": "List of assemblies within the node (supports nested assemblies)",
      "items": { "$ref": "#/$defs/assembly" }
    }
  },
  "required": ["nodeId", "nodeType", "assemblies"],
  "$defs": {
    "assembly": {
      "type": "object",
      "properties": {
        "assemblyName": { "type": "string" },
        "assemblyId": { "type": "string" },
        "manufacturerSerialNumber": { "type": "string", "description": "Manufacturer's serial number for the assembly" },
        "physicalLocation": {
          "type": "object",
          "description": "Physical slot or bay where this assembly is installed",
          "properties": {
            "slot": { "type": "string", "description": "Physical slot identifier (e.g., PCIe slot, OCP slot)" },
            "Position": { "type": "string", "description": "Position within the node or assembly" }
          }
        },
        "logicalAssociation": {
          "type": "object",
          "description": "Logical connectivity details for this assembly",
          "properties": {
            "links": {
              "type": "array",
              "description": "List of logical links consumed by this assembly",
              "items": {
                "type": "object",
                "properties": {
                  "connectedTo": { "type": "string" },
                  "protocol": { "type": "string" },
                  "laneCount": { "type": "integer" }
                },
                "required": ["connectedTo", "protocol"]
              }
            }
          }
        },
        "components": { "type": "array", "items": { "$ref": "#/$defs/component" } },
        "subAssemblies": { "type": "array", "items": { "$ref": "#/$defs/assembly" } }
      },
      "required": ["assemblyName", "assemblyId"]
    },
    "component": {
      "type": "object",
      "properties": {
        "componentType": { "type": "string", "enum": ["CPU", "Memory", "NIC", "Storage", "GPU", "PSU", "Fan", "BIOS", "BMC", "AMC"] },
        "componentId": { "type": "string" },
        "manufacturerSerialNumber": { "type": "string", "description": "Manufacturer's serial number for the component" },
        "physicalLocation": {
          "type": "object",
          "description": "Physical slot or bay where this component is installed",
          "properties": {
            "slot": { "type": "string", "description": "Physical slot identifier (e.g., PCIe slot, DIMM slot)" },
            "Position": { "type": "string", "description": "Position within the node or assembly" }
          }
        },
        "logicalAssociation": {
          "type": "object",
          "description": "Logical connectivity details for this component",
          "properties": {
            "links": {
              "type": "array",
              "description": "List of logical links consumed by this component",
              "items": {
                "type": "object",
                "properties": {
                  "connectedTo": { "type": "string" },
                  "protocol": { "type": "string" },
                  "laneCount": { "type": "integer" }
                },
                "required": ["connectedTo", "protocol"]
              }
            }
          }
        },
        "firmware": {
          "type": "array",
          "description": "List of firmware entries for the component",
          "items": {
            "type": "object",
            "properties": {
              "version": { "type": "string", "description": "Firmware version" },
              "lastUpdated": { "type": "string", "format": "date-time", "description": "Timestamp of last firmware update" },
              "securityVersionNumber": { "type": "integer", "description": "Current Security Version Number (SVN)" },
              "minimumSecurityVersionNumber": { "type": "integer", "description": "Minimum enforced Security Version Number (SVN)" },
              "imageRole": {
                "type": "string",
                "enum": ["Active", "Recovery", "Standby"],
                "description": "Indicates if this firmware is actively running or a redundant recovery image"
              }
            },
            "required": ["version"]
          }
        },
        "configuration": {
          "type": "array",
          "description": "Custom configuration attributes for the component",
          "items": {
            "type": "object",
            "properties": {
              "name": { "type": "string", "description": "Configuration attribute name" },
              "value": { "type": "string", "description": "Configuration attribute value" },
              "description": { "type": "string", "description": "Optional description of the attribute" }
            },
            "required": ["name", "value"]
          }
        }
      },
      "required": ["componentType", "componentId", "firmware"]
    }
  }
}